Repo,Link,Archived,Creation Date,Description,Topics,#Star,#Watch,#Fork,#Releases,#Contributors,Languages,Size,#Open Issues,#Pull Requests,#Branches,#Tags,#Commits,#Comments,#Downloads,#Deployments
eto-ai/rikai,https://github.com/eto-ai/rikai,False,2021-01-08 03:13:33,Parquet-based ML data format optimized for working with unstructured data,"['machine-learning', 'pytorch', 'deep-learning', 'spark', 'tensorflow']",123,8,19,31,10,Jupyter Notebook,16676,112,3,5,37,439,0,0,0
GokuMohandas/mlops-course,https://github.com/GokuMohandas/mlops-course,False,2020-11-12 03:05:00,A project-based course on the foundations of MLOps with a focus on intuition and application.,"['machine-learning', 'applied-ml', 'deep-learning', 'pytorch', 'mlops']",1674,39,306,0,1,Jupyter Notebook,8880,0,0,2,1,14,0,0,38
thiagomarquesrocha/siameseQAT,https://github.com/thiagomarquesrocha/siameseQAT,False,2019-02-04 00:34:50,"SiameseQAT, a duplicate bug report detection method that considers not only information on individual bugs, but also collective information from bug clusters. SiameseQAT combines attention mechanisms, which were not previously used in this task, with a novel loss function called Quintet Loss, that considers the centroid of duplicate bug report representation clusters andtheir contextual information.",[],5,3,2,7,1,Python,54964,3,3,5,8,332,0,0,0
MathiasGruber/ProofOfConcept_MLOps,https://github.com/MathiasGruber/ProofOfConcept_MLOps,False,2021-04-13 11:17:15,Example MLOps using BentoML & mlFlow,[],28,2,12,0,1,HCL,10,0,0,1,0,1,0,0,0
stanford-futuredata/ColBERT,https://github.com/stanford-futuredata/ColBERT,False,2020-05-25 18:01:18,"ColBERT: state-of-the-art neural search (SIGIR'20, TACL'21, NeurIPS'21, NAACL'22, CIKM'22)",[],580,21,156,0,6,Python,638,26,8,13,0,146,0,0,45
HLTCHKUST/framing-bias-metric,https://github.com/HLTCHKUST/framing-bias-metric,False,2022-04-13 09:51:00,,[],5,5,0,0,1,Python,44911,2,0,1,0,23,0,0,0
mlflow/mlflow-torchserve,https://github.com/mlflow/mlflow-torchserve,False,2020-09-18 18:34:01,Plugin for deploying MLflow models to TorchServe,[],70,7,17,1,8,Python,2587,3,1,11,1,448,0,0,0
TeoMeWhy/game-lake-house,https://github.com/TeoMeWhy/game-lake-house,False,2022-08-11 12:08:42,,[],44,3,7,0,2,Python,41,0,0,1,0,38,0,0,0
bernhard-42/db-12-vscode,https://github.com/bernhard-42/db-12-vscode,False,2020-04-28 15:01:14,"Send code blocks (Python, SQL, Scala, R) to a Databricks cluster",[],6,2,1,1,1,TypeScript,14255,7,7,9,2,152,0,0,0
csebuetnlp/CrossSum,https://github.com/csebuetnlp/CrossSum,False,2021-12-15 20:13:46,"This repository contains the code, data, and models of the paper titled ""CrossSum: Beyond English-Centric Cross-Lingual Abstractive Text Summarization for 1500+ Language Pairs"".",['cross-lingual-summarization'],27,3,5,0,3,Python,5912,0,0,1,0,9,0,0,0
akuhren/selective_gp,https://github.com/akuhren/selective_gp,False,2020-06-07 14:34:12,"Code accompanying the paper ""Probabilistic Selection of Inducing Points in Sparse Gaussian Processes"".",[],16,1,5,0,1,Jupyter Notebook,51425,17,17,18,0,15,0,0,0
sofianhamiti/amazon-sagemaker-pipelines-mlflow,https://github.com/sofianhamiti/amazon-sagemaker-pipelines-mlflow,False,2021-07-24 13:35:09,Step-by-step guide to using MLflow in a SageMaker MLOps project,[],7,3,3,0,1,Python,16,0,0,1,0,4,0,0,0
sebastianbirk/datascience-bootcamp,https://github.com/sebastianbirk/datascience-bootcamp,False,2022-04-22 08:18:51,This repository contains all materials for the avanade asg data science bootcamp,[],5,4,6,0,6,Jupyter Notebook,267945,0,0,1,0,423,0,0,0
kevinykuo/odscwest2018,https://github.com/kevinykuo/odscwest2018,False,2018-11-03 17:53:11,"Demos for ODSC West 2018 session ""Scalable Data Science and Deep Learning with R""",[],6,2,3,0,1,HTML,233,0,0,1,0,3,0,0,0
achao2013/deep3dmap,https://github.com/achao2013/deep3dmap,False,2021-10-07 03:45:29,deep 3d reconstruction,[],35,2,1,0,1,Python,3717,2,0,1,1,64,0,0,0
Zainali5/PyRapidML,https://github.com/Zainali5/PyRapidML,False,2021-05-30 06:05:41,PyRapidML is an open source Python library which not only helps in automating Machine Learning Workflows but also helps in building end to end ML algorithms .,[],14,1,0,2,1,Jupyter Notebook,1572,1,0,1,2,57,0,0,0
Paulescu/hands-on-rl,https://github.com/Paulescu/hands-on-rl,False,2021-10-26 22:18:49,Free course that takes you from zero to Reinforcement Learning PRO 🦸🏻‍🦸🏽,"['reinforcement-learning', 'deep-reinforcement-learning']",131,9,33,0,3,Jupyter Notebook,1994,0,0,2,0,115,0,0,0
zhangbo2008/powerful_chinese_ASR,https://github.com/zhangbo2008/powerful_chinese_ASR,False,2021-08-04 09:29:23,facebook 开源的 wav2vec模型. 确实很sota,[],5,1,3,0,0,Python,3654,2,0,1,0,3,0,0,0
khuyentran1401/employee-future-prediction,https://github.com/khuyentran1401/employee-future-prediction,False,2022-04-18 14:43:37,Demo for Using GitHub Actions in MLOps,[],23,0,5,0,2,Jupyter Notebook,383,0,0,2,0,137,0,0,0
MolecularAI/Qptuna,https://github.com/MolecularAI/Qptuna,False,2022-01-21 10:29:25,QPTUNA: QSAR model building with the optuna framework,"['qsar', 'qsar-models', 'hyperparameter-optimization', 'compchem', 'computational-chemistry', 'optuna', 'smiles-strings']",11,2,3,1,0,Jupyter Notebook,644,0,0,1,1,1,0,0,0
Substra/substra-documentation,https://github.com/Substra/substra-documentation,False,2020-03-10 17:29:54,This is where the Substra documentation is forged,[],8,6,5,3,19,Python,52763,6,5,10,11,592,2,0,157
made-ml-in-prod-2021/ml_project_example,https://github.com/made-ml-in-prod-2021/ml_project_example,False,2021-04-04 16:07:55,Демонстрация структуры ml проекта ,[],8,2,3,0,1,Python,2662,1,1,6,0,6,0,0,0
simplybusiness/code-first-pipelines,https://github.com/simplybusiness/code-first-pipelines,False,2022-09-07 13:22:35,A code-first way to define Ploomber pipelines,"['data-pipelines', 'machine-learning-pipelines', 'ploomber']",6,3,0,0,2,Python,291,0,0,3,1,19,0,0,0
omegaml/omegaml,https://github.com/omegaml/omegaml,False,2018-12-10 13:20:15,"Python analytics made easy - an open source DataOps, MLOps platform for humans","['data-science', 'scikit-learn', 'jupyter-notebook', 'docker-image', 'deploy', 'machine-learning', 'artificial-intelligence', 'productized']",79,4,10,18,5,Python,77739,50,15,41,44,248,0,0,4
Ark-kun/google_cloud_mlflow,https://github.com/Ark-kun/google_cloud_mlflow,False,2021-08-10 04:42:24,Experimental MLflow plugin for Google Cloud Vertex AI,[],25,6,6,2,1,Python,163,0,0,3,2,64,0,0,0
odh-labs/ml-workshop,https://github.com/odh-labs/ml-workshop,False,2022-04-11 00:32:52,Open Data Hub Machine Learning Workshop,[],8,1,10,0,4,Jupyter Notebook,40747,8,0,1,0,171,0,0,0
fengbingchun/PyTorch_Test,https://github.com/fengbingchun/PyTorch_Test,False,2019-01-24 09:24:59,PyTorch's usage,[],9,1,3,0,2,C++,264586,0,0,1,0,35,0,0,0
Unbabel/OpenKiwi,https://github.com/Unbabel/OpenKiwi,False,2019-02-04 10:53:37,Open-Source Machine Translation Quality Estimation in PyTorch,"['machine-translation', 'quality-estimation', 'pytorch', 'translation-quality-estimation', 'openkiwi', 'pytorch-lightning']",215,27,47,3,7,Python,35198,20,3,7,6,48,0,0,30
Deena-Gergis/mlflow_tracking,https://github.com/Deena-Gergis/mlflow_tracking,False,2021-09-24 15:06:48,Illustarting basic functionality of MLflow tracking ,[],8,1,1,0,1,Jupyter Notebook,11,0,0,1,0,2,0,0,0
phamdinhkhanh/general_ocr,https://github.com/phamdinhkhanh/general_ocr,False,2021-10-13 07:23:50,,[],57,1,13,1,2,Python,39148,2,0,1,1,9,0,0,0
zachalexander/book-recommender,https://github.com/zachalexander/book-recommender,False,2020-07-07 01:33:56,,[],11,0,3,0,1,Python,485637,4,4,5,0,30,0,0,0
feast-dev/feast,https://github.com/feast-dev/feast,False,2018-12-10 07:20:15,Feature Store for Machine Learning,"['machine-learning', 'features', 'ml', 'big-data', 'feature-store', 'python', 'mlops', 'data-engineering', 'data-science', 'data-quality']",3701,71,684,82,159,Python,81984,156,6,37,122,2863,27,0,17
pycaret/pycaret,https://github.com/pycaret/pycaret,False,2019-11-23 18:40:48,"An open-source, low-code machine learning library in Python","['data-science', 'citizen-data-scientists', 'python', 'machine-learning', 'pycaret', 'ml', 'gpu', 'time-series', 'regression', 'classification', 'anomaly-detection', 'nlp', 'clustering']",6423,118,1472,19,89,Jupyter Notebook,182882,302,3,7,24,4127,9,0,6
e-mon/lish-moa,https://github.com/e-mon/lish-moa,False,2020-11-18 13:41:58,,[],20,5,7,0,2,Python,239,0,0,7,0,59,0,0,0
mberr/rank-based-evaluation,https://github.com/mberr/rank-based-evaluation,False,2020-10-30 18:30:18,"Code for the paper ""On the Ambiguity of Rank-Based Evaluation of Entity Alignment or Link Prediction Methods"" (https://arxiv.org/abs/2002.06914)","['entity-alignment', 'knowledge-graph', 'evaluation-metrics']",5,2,0,1,1,Python,73,0,0,1,1,1,0,0,0
upura/yans2021-hackathon,https://github.com/upura/yans2021-hackathon,False,2021-08-16 09:37:30,,[],6,0,0,0,3,Python,249,0,0,3,0,137,0,0,0
pnnl/neuromancer,https://github.com/pnnl/neuromancer,False,2020-10-14 19:35:17,Pytorch-based framework for solving parametric constrained optimization problems. ,[],97,12,18,0,1,Python,188312,0,0,7,0,1,0,0,8
open-metadata/OpenMetadata,https://github.com/open-metadata/OpenMetadata,False,2021-08-01 21:17:17,"Open Standard for Metadata. A Single place to Discover, Collaborate and Get your data right.","['metadata', 'bigdata', 'datadiscovery', 'data-science', 'dataquality', 'data-profiling', 'metadata-management', 'metadata-api', 'bigdataanalytics', 'governance', 'datascience', 'dataengineering', 'automation', 'data-catalog', 'data-observability', 'dbt', 'data-quality-monitoring', 'data-discovery', 'hacktoberfest', 'hacktoberfest2022']",1506,20,333,31,112,TypeScript,720865,591,60,177,34,4529,20,0,19303
darshikaf/mlflow-tracking-server-with-minio,https://github.com/darshikaf/mlflow-tracking-server-with-minio,False,2020-04-18 23:26:02,Dockerized MLFlow Tracking server with minIO artifact storage server.,[],10,2,4,0,1,Python,6,0,0,1,0,4,0,0,0
algorithmiaio/mlflow-algorithmia,https://github.com/algorithmiaio/mlflow-algorithmia,False,2020-11-24 14:32:58,mlflow extension for Algorithmia,[],6,3,0,0,1,Python,97,0,0,1,6,28,0,0,0
retkowsky/Azure-Databricks-Workshop,https://github.com/retkowsky/Azure-Databricks-Workshop,False,2020-07-06 08:34:18,Azure Databricks workshop,"['azure-databricks', 'spark']",5,2,5,0,1,Jupyter Notebook,2127,0,0,1,0,10,0,0,0
microsoft/qlib,https://github.com/microsoft/qlib,False,2020-08-14 06:46:00,"Qlib is an AI-oriented quantitative investment platform, which aims to realize the potential, empower the research, and create the value of AI technologies in quantitative investment. With Qlib, you can easily try your ideas to create better Quant investment strategies. An increasing number of  SOTA Quant research works/papers are released in Qlib.","['quantitative-finance', 'machine-learning', 'stock-data', 'platform', 'finance', 'algorithmic-trading', 'python', 'investment', 'quant', 'quantitative-trading', 'quant-dataset', 'quant-models', 'auto-quant', 'fintech', 'research-paper', 'paper', 'research', 'deep-learning']",9788,243,1752,15,97,Python,16023,227,49,39,18,1851,9,0,0
averkij/a-studio,https://github.com/averkij/a-studio,False,2021-06-20 16:44:51,Lingtrain Alignment Studio is an ML based app for texts alignment on different languages. It can produce parallel corpora and parallel books.,[],164,10,12,0,1,Vue,83652,0,0,4,0,188,0,0,0
GuinsooLab/darkseal,https://github.com/GuinsooLab/darkseal,False,2022-07-03 06:38:43,"A Single place to Discover, Collaborate, and Get your data right","['metadata', 'catalog', 'data-catalog', 'data-discovery', 'data-platform', 'data-structures', 'metadata-management', 'metadata-standard']",12,1,3,2,1,TypeScript,174905,1,0,6,3,39,0,0,0
ryanchynoweth44/DatabricksContent,https://github.com/ryanchynoweth44/DatabricksContent,False,2018-12-17 18:26:29,Examples surrounding Databricks. ,[],32,6,9,0,2,Jupyter Notebook,3783,0,0,1,0,99,0,0,0
yueureka/WildFireDetection,https://github.com/yueureka/WildFireDetection,False,2020-06-09 03:56:49,Using U-Net Model to Detect Wildfire from Satellite Imagery ,"['wildfire', 'satellite-imagery', 'wildfire-detection', 'unet-model', 'streamlit', 'databricks', 'deep-learning', 'docker', 'ai', 'sparkaisummit']",46,4,17,0,4,HTML,65580,3,3,5,0,59,0,0,0
facultyai/hiplot-mlflow,https://github.com/facultyai/hiplot-mlflow,False,2020-05-01 14:50:54,HiPlot fetcher for experiments logged with MLflow,"['mlflow', 'hiplot', 'visualisation', 'machine-learning', 'plotting']",11,13,2,0,3,Python,1799,1,1,2,1,15,0,0,0
pasqualedem/CrowdCounting-on-VisDrone2020,https://github.com/pasqualedem/CrowdCounting-on-VisDrone2020,False,2021-05-22 07:23:24,,[],7,1,0,0,4,Python,4342,0,0,1,0,362,0,0,0
mlflow/mlflow-export-import,https://github.com/mlflow/mlflow-export-import,False,2022-05-25 18:34:52,,[],28,5,12,0,3,HTML,1405,18,3,6,0,463,0,0,0
gradio-app/gradio,https://github.com/gradio-app/gradio,False,2018-12-19 08:24:04,Create UIs for your machine learning model in Python in 3 minutes,"['machine-learning', 'models', 'ui', 'ui-components', 'interface', 'python', 'data-science', 'data-visualization', 'deep-learning', 'data-analysis', 'gradio', 'gradio-interface', 'python-notebook', 'deploy']",10373,82,652,51,93,Python,157888,243,10,63,51,4509,5,0,957
mihail911/fake-news,https://github.com/mihail911/fake-news,False,2020-09-18 05:59:08,Building a fake news detector from initial ideation to model deployment,"['machinelearning', 'deeplearning', 'mlops', 'natural-language-processing', 'nlp', 'pytorch', 'scikit-learn']",122,8,51,0,1,Jupyter Notebook,2751,1,0,1,0,10,0,0,0
khuyentran1401/reproducible-data-science,https://github.com/khuyentran1401/reproducible-data-science,False,2022-03-25 01:33:44,Tutorials on creating a reproducible and maintainable data science project,"['data-science', 'python', 'machine-learning', 'mlops', 'mlops-workflow']",78,3,17,0,1,Jupyter Notebook,4059,3,0,2,0,24,0,0,21
PacktPublishing/EngineeringMLOps,https://github.com/PacktPublishing/EngineeringMLOps,False,2020-08-14 11:56:15,"Engineering MLOps, published by Packt",[],116,7,91,0,5,Jupyter Notebook,2709,3,0,1,0,24,0,0,0
IBM/data-science-best-practices,https://github.com/IBM/data-science-best-practices,False,2021-05-03 21:02:42,"The goal of this repository is to enable data scientists and ML engineers to develop data science use cases and making it ready for production use. This means focusing on the versioning, scalability, monitoring and engineering of the solution.","['ai', 'python', 'devops', 'machine-learning', 'mlops', 'ibm', 'analytics', 'data-science', 'datascience', 'best-practices', 'bestpractices']",59,6,20,0,6,Ruby,21772,0,0,1,0,31,0,0,10
floscha/papermill-mlflow-template,https://github.com/floscha/papermill-mlflow-template,False,2019-03-30 17:53:12,A simple template for using MLflow from Papermill,"['jupyter-notebook', 'papermill', 'mlflow', 'mlflow-tracking-server']",6,1,3,0,2,Jupyter Notebook,51,8,8,9,0,28,0,0,0
gdsc-ys/mlops,https://github.com/gdsc-ys/mlops,False,2022-08-07 05:46:42,For the continuous ML Dev,[],6,1,0,0,1,Dockerfile,2263,0,0,1,0,22,0,0,0
hskaailabcv/source,https://github.com/hskaailabcv/source,False,2019-03-21 17:44:37,,[],11,5,3,0,2,Jupyter Notebook,55106,1,1,2,0,25,0,0,0
aporia-ai/mlplatform-workshop,https://github.com/aporia-ai/mlplatform-workshop,False,2021-06-09 20:42:22,"🍫 Example code for a basic ML Platform based on Pulumi, FastAPI, DVC, MLFlow and more","['mlops', 'machine-learning', 'devops']",360,11,52,0,2,TypeScript,614,2,0,3,0,19,1,0,0
microsoft/protein-sequence-models,https://github.com/microsoft/protein-sequence-models,False,2021-05-20 20:54:25,,[],98,6,16,0,6,Python,7491,4,0,5,0,375,0,0,0
databricks/automl,https://github.com/databricks/automl,False,2021-08-06 23:02:15,,[],15,8,11,10,10,Python,171,1,0,12,30,85,0,0,0
tsterbak/pydataberlin-2019,https://github.com/tsterbak/pydataberlin-2019,False,2019-08-09 11:16:33,"This Repository contains the material for my tutorial ""Managing the end-to-end machine learning lifecycle with MLFlow"" at pyData/pyCon Berlin 2019.",[],37,3,44,0,4,Jupyter Notebook,291,4,3,4,0,36,0,0,0
PacktPublishing/Machine-Learning-Engineering-with-MLflow,https://github.com/PacktPublishing/Machine-Learning-Engineering-with-MLflow,False,2020-09-14 12:40:08,"Machine Learning Engineering with MLflow, published by Packt",[],73,8,54,0,6,HTML,3266,11,1,3,0,49,0,0,0
takashiishida/flooding,https://github.com/takashiishida/flooding,False,2020-02-10 03:52:07,Code for flooding,[],77,5,6,0,3,Python,441,0,0,2,0,29,0,0,0
codecypher/LearnAI,https://github.com/codecypher/LearnAI,False,2022-06-02 03:39:47,,[],6,2,0,0,1,Python,27474,0,0,1,0,106,0,0,0
kargarisaac/blog,https://github.com/kargarisaac/blog,False,2020-04-12 16:09:57,The repo for my blog posts,[],9,1,3,0,1,Jupyter Notebook,663871,5,4,7,0,311,0,0,278
lluissalord/radiology_ai,https://github.com/lluissalord/radiology_ai,False,2020-09-02 06:17:09,OpenSource project collaborating with a healthcare mutual insurance company (data provider) focusing on classifying knee frontal radiographies (DICOM) according to Schatzker classification (0 to 6).,"['pytorch', 'radiography', 'schatzker-classification', 'deep-learning', 'semi-supervised-learning', 'dicom-files']",5,4,0,0,1,Jupyter Notebook,61744,0,0,9,0,326,0,0,86
koernigo/databricksMLOpsAzureDemo,https://github.com/koernigo/databricksMLOpsAzureDemo,False,2021-02-04 18:16:41,,[],12,2,20,0,1,Python,17,0,0,1,0,8,0,0,0
comet-ml/comet-examples,https://github.com/comet-ml/comet-examples,False,2018-11-21 18:00:34,Examples of Machine Learning code using Comet.ml ,"['machine-learning', 'comet-ml', 'python', 'deep-learning', 'deep-learning-algorithms', 'deep-learning-python', 'machine-learning-platform', 'deep-learning-libraries']",101,9,51,0,13,Jupyter Notebook,8058,6,5,17,0,299,3,0,0
lfbraz/azure-data-science-e2e,https://github.com/lfbraz/azure-data-science-e2e,False,2020-10-01 19:10:05,,[],22,5,7,0,4,Jupyter Notebook,4794,0,0,4,0,131,4,0,0
amesar/mlflow-tools,https://github.com/amesar/mlflow-tools,False,2020-01-09 22:01:53,Tools for MLflow,[],29,6,7,0,1,Python,339,2,0,1,2,147,0,0,0
Duankaiwen/LSNet,https://github.com/Duankaiwen/LSNet,False,2021-04-08 17:33:30,Location-Sensitive Visual Recognition with Cross-IOU Loss,"['object-detection', 'instance-segmentation', 'pose-estimation']",146,7,27,0,3,Python,28678,23,0,1,0,182,0,0,0
anyscale/ray-summit-2022-training,https://github.com/anyscale/ray-summit-2022-training,False,2022-05-13 01:01:57,This is the GitHub Repo for Ray Summit Training 2022,[],9,3,3,0,8,Jupyter Notebook,59103,0,0,113,0,360,1,0,0
Azure/azureml-examples,https://github.com/Azure/azureml-examples,False,2020-08-21 18:04:26,"Official community-driven Azure Machine Learning examples, tested with GitHub Actions.","['azure', 'azureml', 'ml', 'azure-machine-learning', 'data-science']",817,2778,589,0,116,Jupyter Notebook,454904,216,157,289,0,659,9,0,23
PacktPublishing/Machine-Learning-on-Kubernetes,https://github.com/PacktPublishing/Machine-Learning-on-Kubernetes,False,2021-10-25 10:46:26,"Machine Learning on Kubernetes, published by packt",[],29,8,23,0,6,Jupyter Notebook,368,4,0,1,0,230,0,0,0
SALT-NLP/Adaptive-Compositional-Modules,https://github.com/SALT-NLP/Adaptive-Compositional-Modules,False,2022-03-15 14:28:25,"Code for the ACL 2022 paper ""Continual Sequence Generation with Adaptive Compositional Modules""","['continual-learning', 'lifelong-learning', 'sequence-generation', 'natural-language-processing', 'adapter', 'parameter-efficient-learning', 'question-answering']",25,2,2,0,1,Python,2990,0,0,1,0,7,0,0,0
alejio/mlflow-tracking-action,https://github.com/alejio/mlflow-tracking-action,False,2020-09-01 17:54:53,Github Action for retrieving MLflow runs for use within a pull request workflow.,[],9,2,1,3,1,Python,24,1,0,1,4,18,0,0,0
dod-advana/gamechanger-ml,https://github.com/dod-advana/gamechanger-ml,False,2021-05-05 17:51:05,GAMECHANGER Machine Learning Repo,"['dod', 'policy-as-code', 'ml', 'machine-learning', 'python', 'nlp', 'natural-language-processing', 'transformer', 'mlops']",13,14,7,7,15,Python,182693,2,2,174,8,1241,0,0,0
SnapperML/SnapperML,https://github.com/SnapperML/SnapperML,False,2019-11-05 10:54:47,SnapperML is a framework for machine learning. It has many functionalities including scalability through docker instances and reproducibility.,"['mlops', 'machine-learning', 'data-science', 'reproducibility', 'cluster']",13,3,1,0,3,Python,84906,15,15,23,0,466,0,0,0
meteofrance/formation-mlflow,https://github.com/meteofrance/formation-mlflow,False,2020-04-10 09:55:52,"Une formation pour apprendre à utiliser ML Flow, un dashboard pour expériences de Machine Learning",[],7,3,0,0,1,Jupyter Notebook,158,2,2,3,0,12,0,0,0
boxkite-ml/boxkite,https://github.com/boxkite-ml/boxkite,False,2020-12-02 06:00:14,Concept drift monitoring for HA model servers.,[],95,2,10,3,5,Python,2491,13,7,9,3,167,0,0,0
udacity/cd0581-building-a-reproducible-model-workflow-exercises,https://github.com/udacity/cd0581-building-a-reproducible-model-workflow-exercises,False,2022-05-06 17:01:54,Exercise Staters and solutions for cd0581-building-a-reproducible-model-workflow by Giacomo Vianello,[],8,4,21,0,1,Jupyter Notebook,5799,8,0,2,0,2,0,0,0
osin-vladimir/mlflow_tutorial,https://github.com/osin-vladimir/mlflow_tutorial,False,2019-09-25 09:13:03,Managing machine learning life-cycle with MLflow tutorial ,"['data-science', 'machine-learning', 'mlflow', 'lifecycle']",20,2,11,0,1,Jupyter Notebook,1285,2,2,4,0,25,0,0,0
PacktPublishing/Azure-Data-Scientist-Associate-Certification-Guide,https://github.com/PacktPublishing/Azure-Data-Scientist-Associate-Certification-Guide,False,2020-08-20 15:21:35,"Microsoft Certified: Azure Data Scientist Associate Certification Guide, published by Packt",[],28,6,21,0,5,Jupyter Notebook,1947,0,0,1,0,69,0,0,0
sayalaruano/100DaysOfMLCode,https://github.com/sayalaruano/100DaysOfMLCode,False,2021-09-10 15:05:32,My progress log and projects I have worked on during the 100DaysOfMLCode challenge ,[],11,1,2,0,1,Jupyter Notebook,211848,0,0,1,0,100,0,0,0
Nintorac/NeuralDX7,https://github.com/Nintorac/NeuralDX7,False,2020-05-14 00:21:57,Deep models related to the Yamaha DX7,[],129,8,10,0,1,Python,87,1,0,3,0,11,0,0,0
cortexlabs/nucleus,https://github.com/cortexlabs/nucleus,False,2021-11-12 18:44:16,Cortex-compatible model server for Python and TensorFlow,[],14,2,0,4,2,Python,245,0,0,3,4,16,0,0,0
getindata/kedro-airflow-k8s,https://github.com/getindata/kedro-airflow-k8s,False,2021-01-27 09:26:27,Kedro Plugin to support running pipelines on Kubernetes using Airflow.,"['machinelearning', 'airflow', 'mlops', 'kedro', 'kedro-airflow', 'k8s', 'kuberentes', 'kedro-plugin']",19,11,8,27,12,Python,372,18,5,10,27,148,0,0,0
Clearbox-AI/clearbox-wrapper,https://github.com/Clearbox-AI/clearbox-wrapper,False,2020-05-22 09:41:50,An agnostic wrapper for the most common ML frameworks.,[],10,5,0,16,3,Python,5987,2,0,2,16,158,0,0,0
violet-zct/swarm-distillation-zero-shot,https://github.com/violet-zct/swarm-distillation-zero-shot,False,2021-10-24 04:38:00,,[],11,2,1,0,421,Python,81741,0,0,288,80,8702,0,0,0
ziritrion/mlopszoomcamp,https://github.com/ziritrion/mlopszoomcamp,False,2022-05-16 19:23:10,Homework and notes for the DataTalks.Club MLOps Zoomcamp,[],6,2,1,0,1,Jupyter Notebook,62,0,0,1,0,14,0,0,0
liartem/mlops-zoomcamp,https://github.com/liartem/mlops-zoomcamp,False,2022-05-23 09:35:29,,[],12,1,1,0,1,Python,41427,0,0,1,0,127,0,0,0
YiSyuanChen/MTL-ABS,https://github.com/YiSyuanChen/MTL-ABS,False,2021-01-31 12:50:12,"Original PyTorch implementation for AAAI 2021 Paper ""Meta-Transfer Learning for Low-Resrouce Abstractive Summarization"" by Yi-Syuan Chen and Hong-Han Shuai.","['meta-learning', 'transfer-learning', 'low-resource', 'abstractive-summarization']",19,1,3,0,1,Python,365,0,0,1,0,8,0,0,0
solliancenet/Azure-Machine-Learning-Dev-Guide,https://github.com/solliancenet/Azure-Machine-Learning-Dev-Guide,False,2019-05-08 16:39:27,,[],9,11,8,0,5,,30083,0,0,1,0,277,0,0,0
salesforce/CodeRL,https://github.com/salesforce/CodeRL,False,2022-06-30 02:54:36,This is the official code for the paper CodeRL: Mastering Code Generation through Pretrained Models and Deep Reinforcement Learning.,"['ai', 'codegeneration', 'languagemodel', 'machinelearning', 'programsynthesis', 'reinforcementlearning']",179,13,21,0,3,Python,24930,11,9,10,0,32,0,0,0
josephdviviano/saliency-red-herring,https://github.com/josephdviviano/saliency-red-herring,False,2021-02-05 22:49:46,"Code for Saliency is a Possible Red Herring When Diagnosing Poor Generalization, Viviano et al ICLR 2021",[],6,2,0,0,4,Jupyter Notebook,76538,0,0,2,0,632,0,0,0
ghostcat404/MLops_setup,https://github.com/ghostcat404/MLops_setup,False,2021-06-01 12:56:06,,"['jenkins-setup', 'jenkins-multibranch-pipeline', 'gitlab-server', 'plot', 'mlflow', 'minio']",5,1,0,0,1,Shell,1074,0,0,3,0,36,0,0,0
AICoE/prometheus-anomaly-detector,https://github.com/AICoE/prometheus-anomaly-detector,False,2019-05-15 19:10:22,A newer more updated version of the prometheus anomaly detector (https://github.com/AICoE/prometheus-anomaly-detector-legacy),"['hacktoberfest', 'metric-data', 'prometheus-metrics', 'prometheus-anomaly-detector', 'predicted-metrics', 'prophet-model']",486,20,118,0,14,Jupyter Notebook,11036,9,5,18,0,156,0,0,0
layerai/sdk,https://github.com/layerai/sdk,False,2022-04-25 17:42:30,Metadata store for Production ML,"['machine-learning', 'collaboration', 'data-science', 'data-versioning', 'deep-learning', 'experiment-tracking', 'hyperparameter-optimization', 'hyperparameter-tuning', 'keras', 'mlops', 'model-versioning', 'python', 'pytorch', 'reinforcement-learning', 'sklearn', 'tensorflow']",89,8,4,276,15,Python,2328,2,0,36,278,414,1,0,0
kelsey-huntzberry/DataAnalysisLab,https://github.com/kelsey-huntzberry/DataAnalysisLab,False,2019-07-24 02:53:21,,[],11,0,5,0,2,Jupyter Notebook,34727,0,0,2,0,219,0,0,0
