Repo,Link,Archived,Creation Date,Description,Topics,#Star,#Watch,#Fork,#Releases,#Contributors,Languages,Size,#Open Issues,#Pull Requests,#Branches,#Tags,#Commits,#Comments,#Downloads,#Deployments
leokarlin/LaSO,https://github.com/leokarlin/LaSO,False,2019-04-01 14:33:33,LaSO: Label-Set Operations networks for multi-label few-shot learning - official implementation,[],75,6,13,0,2,Python,311,3,1,2,0,69,0,0,0
al102964/ml-deployment,https://github.com/al102964/ml-deployment,False,2020-01-28 13:27:07,Repo for post,[],5,3,1,0,1,Jupyter Notebook,9,2,2,3,0,6,0,0,0
mlrepa/mlpanel,https://github.com/mlrepa/mlpanel,False,2020-01-22 20:31:44,ML Project control panel ,[],9,5,0,2,2,Python,91,9,9,13,2,10,0,0,0
particle1331/inefficient-networks,https://github.com/particle1331/fitter-happier-models,False,2021-03-21 19:55:37,Self-contained notebooks on machine learning engineering and operations. ❚,"['machine-learning', 'deep-learning', 'tensorflow2', 'fastapi', 'jupyterbook']",21,0,5,0,1,Makefile,672520,0,0,4,0,1947,0,0,1031
microsoft/MLOpsTemplate,https://github.com/microsoft/MLOpsTemplate,False,2022-02-03 20:38:51,Providing tools and templates to facilitate modern MLOps practices,"['mlops', 'active-learning']",41,2,131,0,9,Jupyter Notebook,25825,2,0,13,0,1158,1,0,0
splunk/splunk-mltk-container-docker,https://github.com/splunk/splunk-mltk-container-docker,False,2019-09-27 13:34:36,Deep Learning Toolkit for Splunk,[],23,18,20,0,2,Jupyter Notebook,1428,3,2,12,0,72,0,0,0
deepyaman/kedro-streaming,https://github.com/deepyaman/kedro-streaming,False,2021-02-25 09:54:40,,[],8,2,0,0,2,Python,68000,9,0,5,0,23,0,0,0
mlf-core/mlf-core,https://github.com/mlf-core/mlf-core,False,2020-08-01 07:43:43,CPU and GPU deterministic and therefore fully reproducible machine learning pipelines using MLflow.,"['mlflow', 'template', 'machinelearning', 'artificialintelligence', 'reproducible', 'deterministic', 'gpu', 'hacktoberfest']",35,2,2,32,6,Python,26173,29,14,24,32,1050,3,0,0
retkowsky/Cloud_Workshop_AzureDatabricks,https://github.com/retkowsky/Cloud_Workshop_AzureDatabricks,False,2019-03-19 11:44:59,Cloud Workshop Azure Databricks,"['azure', 'databricks', 'databricks-notebooks']",5,2,3,0,1,Jupyter Notebook,41064,0,0,1,0,103,0,0,0
thevasudevgupta/transformers-adapters,https://github.com/thevasudevgupta/transformers-adapters,False,2021-03-20 12:18:03,"This repositary hosts my experiments for the project, I did with OffNote Labs.","['pretrained-models', 'transformers', 'huggingface', 'indian-languages', 'translation-task', 'adapters']",9,2,3,0,1,Python,3023,1,0,1,0,9,0,0,0
aiaudit-org/raw2logit,https://github.com/aiaudit-org/raw2logit,False,2021-08-26 09:17:29,"In order to control processing-induced dataset drift we require two ingredients: raw sensor data and an image processing model. This code repository contains the materials for the second ingredient, the image processing models, as well as scripts to load lada and run experiments.","['distribution', 'shift', 'drift', 'camera', 'optics', 'machine-learning', 'deep-learning', 'deep-neural-networks', 'robustness', 'pytorch']",7,1,2,0,2,Python,19109,3,0,2,0,87,0,0,0
dbczumar/mlflow-keras-ffnn-mnist,https://github.com/dbczumar/mlflow-keras-ffnn-mnist,False,2019-03-26 18:26:08,MLproject for training a feed-forward neural network on MNIST in Keras,[],6,1,6,0,1,Python,11,0,0,1,0,28,0,0,0
facultyai/faculty-distributed,https://github.com/facultyai/faculty-distributed,False,2019-05-10 10:22:58,Distributed execution on Faculty platform,"['distributed-computing', 'faculty-platform', 'python']",5,8,0,0,4,Jupyter Notebook,44,2,1,2,0,46,0,0,0
cogment/cogment-verse,https://github.com/cogment/cogment-verse,False,2021-09-15 20:44:04,"Library of Environments, Human Actor UIs and Agent implementation for Human In the Loop Learning & Reinforcement Learning","['reinforcement-learning', 'human-in-the-loop-learning', 'cogment']",27,6,8,0,7,Python,10105,43,5,20,0,34,0,0,0
AutoViML/deep_autoviml,https://github.com/AutoViML/deep_autoviml,False,2021-05-08 18:41:25,Build tensorflow keras model pipelines in a single line of code. Now with mlflow tracking. Created by Ram Seshadri. Collaborators welcome. Permission granted upon request.,"['tensorflow', 'keras', 'automl', 'autokeras', 'pycaret', 'tpot', 'mljar', 'gcp', 'mlflow', 'deep-learning', 'machine-learning', 'python', 'tensorflow2', 'data-science']",99,6,31,0,3,Python,21858,5,1,1,0,133,0,0,0
TheShadow29/VidSitu,https://github.com/TheShadow29/VidSitu,False,2021-02-10 10:28:34,[CVPR21] Visual Semantic Role Labeling for Video Understanding (https://arxiv.org/abs/2104.00990),"['vision', 'vision-and-language', 'grounding', 'nlp', 'video', 'video-language', 'event-relations', 'semantic-roles', 'srl', 'captioning-videos', 'captioning']",42,2,6,0,1,Python,950,5,0,5,0,57,0,0,0
jfzhuang/IFR,https://github.com/jfzhuang/IFR,False,2021-11-22 07:53:14,[CVPR'22] Semi-Supervised Video Semantic Segmentation with Inter-Frame Feature Reconstruction,"['cvpr2022', 'semantic-segmentation', 'semi-supervised-learning', 'semi-supervised-segmentation']",14,1,2,0,1,Python,20650,1,1,1,0,16,0,0,0
jan21deepak/ANZBootcamp,https://github.com/jan21deepak/ANZBootcamp,False,2021-04-13 05:15:33,,[],5,1,16,0,4,Python,156,0,0,4,0,25,0,0,0
databricks/tech-talks,https://github.com/databricks/tech-talks,False,2020-04-03 21:32:14,This repository contains the notebooks and presentations we use for our Databricks Tech Talks ,[],574,87,374,0,25,HTML,136096,6,0,3,0,319,1,0,0
khuyentran1401/Machine-learning-pipeline,https://github.com/khuyentran1401/Machine-learning-pipeline,False,2020-05-03 17:48:01,Example machine learning pipeline with MLflow and Hydra,"['hydra', 'machine-learning-pipeline', 'mlflow', 'machine-learning', 'data-science']",46,1,18,0,1,Python,22069,0,0,1,0,17,0,0,0
kareem-metwaly/glidenet,https://github.com/kareem-metwaly/glidenet,False,2022-03-07 01:33:37,"This repository contains the implementation and the building blocks of GlideNet and Informed Convolution. This work is published at CVPR 2022 paper titled ""GlideNet: Global, Local and Intrinsic based Dense Embedding NETwork for Multi-category Attributes Prediction""",[],16,1,2,0,1,Python,110,0,0,1,0,3,0,0,0
Minyus/pipelinex,https://github.com/Minyus/pipelinex,False,2019-11-15 11:43:39,"PipelineX: Python package to build ML pipelines for experimentation with Kedro, MLflow, and more","['pipeline', 'experimentation', 'machine-learning', 'deep-learning', 'data-science', 'data-engineering']",197,6,10,0,3,Python,1136,1,0,1,42,533,2,0,0
niwilso/data-drift-monitor,https://github.com/niwilso/data-drift-monitor,False,2020-09-28 17:49:19,Example code for integrating a custom data drift monitor into an MLOps solution using Azure Databricks and MLFlow.,[],6,1,0,0,1,Python,6374,0,0,1,0,11,0,0,0
AICoE/experiment-tracking,https://github.com/AICoE/experiment-tracking,False,2018-09-25 16:38:42,Experiment Tracking for Machine Learning Jobs,['artificial-intelligence'],5,3,4,0,1,Shell,3222,0,0,1,0,18,0,0,0
jimthompson5802/mlflow_demo,https://github.com/jimthompson5802/mlflow_demo,False,2019-03-11 02:15:24,Demonstrates mlflow functionality.  Docker containers provide the run-time environment for mlflow.,[],7,2,3,6,1,Jupyter Notebook,1873,2,0,1,6,102,0,0,0
datarevenue-berlin/OpenMLOps,https://github.com/datarevenue-berlin/OpenMLOps,False,2020-10-30 17:23:55,,[],577,16,83,1,16,HCL,9555,23,2,51,3,412,0,0,0
CJHJ/spatiotemporal-transformer-paper,https://github.com/CJHJ/spatiotemporal-transformer-paper,False,2021-02-06 18:13:36,Codes for Spatiotemporal Transformer for 2D Time Series Sequence Forecasting.,[],5,2,0,0,1,Python,1161,0,0,1,0,2,0,0,0
solliancenet/azure-synapse-analytics-workshop-400,https://github.com/solliancenet/azure-synapse-analytics-workshop-400,False,2020-04-01 17:40:56,,[],152,32,147,0,13,PowerShell,1627769,2,0,1,0,879,1,0,0
saeed349/Microservices-Based-Algorithmic-Trading-System,https://github.com/saeed349/Microservices-Based-Algorithmic-Trading-System,False,2020-01-06 00:21:58,"MBATS is a docker based platform for developing, testing and deploying Algorthmic Trading strategies with a focus on Machine Learning based algorithms.",[],225,20,93,0,1,Python,49048,7,3,4,0,22,0,0,0
DataTalksClub/mlops-zoomcamp,https://github.com/DataTalksClub/mlops-zoomcamp,False,2021-10-21 09:35:28,Free MLOps course from DataTalks.Club,"['machine-learning', 'mlops', 'model-deployment', 'model-monitoring', 'workflow-orchestration']",4405,100,805,0,45,Jupyter Notebook,3869,26,2,3,0,317,0,0,0
princeton-nlp/MultilingualAnalysis,https://github.com/princeton-nlp/MultilingualAnalysis,False,2020-12-21 17:58:13,"Repository for the paper titled: ""When is BERT Multilingual? Isolating Crucial Ingredients for Cross-lingual Transfer""","['multilingual', 'transformers', 'multilingual-bert', 'zero-shot', 'cross-lingual']",8,1,0,0,1,Python,50247,0,0,1,0,145,0,0,0
elemeno-ai/elabs-mlflow,https://github.com/elemeno-ai/elabs-mlflow,False,2021-10-23 18:50:49,,[],8,4,1,2,1,Python,12,0,0,1,2,12,0,0,0
neuroailab/physopt-physics-benchmarking,https://github.com/neuroailab/physopt-physics-benchmarking,False,2021-06-07 07:05:50,,[],6,3,0,0,5,Python,2328,0,0,1,0,472,0,0,0
amesar/mlflow-examples,https://github.com/amesar/mlflow-examples,False,2019-11-05 12:49:04,Basic MLflow examples,[],116,4,52,0,1,HTML,1147,4,1,1,0,445,0,0,0
SeanPLeary/mlflow-minio-h2o-example,https://github.com/SeanPLeary/mlflow-minio-h2o-example,False,2019-02-23 09:27:43,MLflow-tracking server example with Minio and H2O,"['h2oai', 'h2o', 'mlflow-tracking-server', 'mlflow', 'minio', 'minio-server']",18,0,8,0,1,Jupyter Notebook,11,1,1,1,0,4,0,0,0
Kthyeon/FINE_official,https://github.com/Kthyeon/FINE_official,False,2021-10-26 16:24:21,"NeurIPS 2021, ""Fine Samples for Learning with Noisy Labels""","['noisy-label-learning', 'semi-supervised-learning', 'neurips2021', 'machine-learning', 'pytorch']",26,3,9,0,6,Python,168341,1,0,7,0,351,0,0,0
NLPatVCU/multitasking_transformers,https://github.com/NLPatVCU/multitasking_transformers,False,2020-03-20 17:23:57,Multitask Learning with Pretrained Transformers,"['clinical-nlp', 'deep-learning', 'bert', 'multi-task-learning']",35,3,8,1,1,Python,2807,2,0,1,1,54,0,0,0
PaulEmmanuelSotir/DeepCV,https://github.com/PaulEmmanuelSotir/DeepCV,False,2020-03-04 21:28:06,"Vision framework which brings a more robust, Deep Learning-based approach to some usual OpenCV use cases","['deep-learning', 'kedro', 'opencv', 'machine-learning', 'python', 'vision', 'vision-framework', 'mlflow', 'pytorch', 'tensorboardx', 'neural-network-intelligence', 'template-project']",6,4,2,0,2,Python,1704,0,0,2,0,172,0,0,0
AISaturdaysLagos/cohort7_practicals,https://github.com/AISaturdaysLagos/cohort7_practicals,False,2021-09-03 20:59:40,This houses all the practicals materials for cohort 7,[],18,4,30,0,8,Jupyter Notebook,11225,0,0,2,0,108,0,0,0
microsoft/bigcarp,https://github.com/microsoft/bigcarp,False,2022-07-18 21:02:28,Masked language models of biosynthetic gene clusters,[],9,3,0,0,3,Python,27,0,0,1,0,12,0,0,0
tudelft/ssl_e2vid,https://github.com/tudelft/ssl_e2vid,False,2021-04-12 12:27:08,,[],37,13,11,0,1,Python,15871,3,0,1,0,3,0,0,0
BIX-Digital/mlflow-openshift,https://github.com/BIX-Digital/mlflow-openshift,False,2021-01-05 13:34:49,MLflow deployment plugin for OpenShift,[],5,4,2,6,3,Python,37,1,0,1,6,23,0,0,0
scaleoutsystems/workshop-intro-to-fedn,https://github.com/scaleoutsystems/workshop-intro-to-fedn,False,2021-05-05 15:11:26,,[],5,3,0,0,2,Jupyter Notebook,66,0,0,1,0,12,0,0,0
RausellLab/Tiresias,https://github.com/RausellLab/Tiresias,False,2019-06-28 14:50:07,Computational framework for disease gene prediction through supervised learning on multiplex biological networks,[],5,2,1,0,3,Python,1962,0,0,3,0,57,0,0,0
microsoft/BackwardCompatibilityML,https://github.com/microsoft/BackwardCompatibilityML,False,2020-07-09 20:14:52,Project for open sourcing research efforts on Backward Compatibility in Machine Learning,[],63,8,11,6,3,HTML,20903,35,4,36,7,48,0,0,0
m30m/gnn-explainability,https://github.com/m30m/gnn-explainability,False,2020-12-10 14:41:17,,[],9,2,0,0,1,Jupyter Notebook,508,0,0,2,0,88,0,0,0
dornasabet/DCGANFER,https://github.com/dornasabet/DCGANFER,False,2021-11-12 11:48:35,,[],5,1,0,0,1,Python,4,0,0,1,0,6,0,0,0
NivedhanSenthilkumar/AllReusableScripts,https://github.com/NivedhanSenthilkumar/AllReusableScripts,False,2021-11-16 11:34:38,,[],6,1,3,0,1,Python,160,0,0,1,0,194,0,0,0
talipucar/BYOL,https://github.com/talipucar/BYOL,False,2021-01-11 12:04:31,"Pytorch implementation of the paper, ""Bootstrap Your Own Latent A New Approach to Self-Supervised Learning"", or BYOL, https://arxiv.org/pdf/2006.07733v3.pdf","['self-supervised', 'self-supervised-learning', 'pytorch', 'byol', 'byol-pytorch']",5,1,1,0,2,Python,27961,0,0,1,0,8,0,0,0
MicrosoftLearning/mslearn-dp100,https://github.com/MicrosoftLearning/mslearn-dp100,False,2020-11-25 16:22:55,Lab files for Azure Machine Learning exercises,[],479,28,523,0,17,Jupyter Notebook,1025,0,0,2,0,192,1,0,134
BenWilson2/ML-Engineering,https://github.com/BenWilson2/ML-Engineering,False,2020-11-18 01:42:31,"Reference code base for ML Engineering, Manning Publications",[],46,4,11,0,1,Jupyter Notebook,45203,2,0,1,0,20,0,0,0
kajyuuen/allennlp-book,https://github.com/kajyuuen/allennlp-book,False,2020-03-03 07:50:12,本リポジトリは「AllenNLP入門」のソースコード置き場です。,"['allennlp', 'nlp']",38,3,4,0,1,Python,766,1,1,2,0,6,0,0,0
datarootsio/tutorial-mlops,https://github.com/datarootsio/tutorial-mlops,False,2022-05-02 20:05:01,MLOps exercise material.,[],16,6,2,0,3,Jupyter Notebook,5824,0,0,1,0,10,0,0,0
ediziks/EPITA-DSA-Notes,https://github.com/ediziks/EPITA-DSA-Notes,False,2022-02-16 11:43:44,"Notes, materials and all related works I've done while pursuing MSc Data Science & Analytics at EPITA","['epita', 'data-science', 'analytics', 'masters']",11,1,2,0,1,Jupyter Notebook,732175,0,0,1,0,254,0,0,0
flmu/mlflow-tracking-server,https://github.com/flmu/mlflow-tracking-server,False,2018-09-28 15:12:54,MLFLow Tracking Server based on Docker and AWS S3,"['docker', 'docker-image', 'mlflow', 'mlflow-tracking-server', 'docker-file', 'databricks', 'machine-learning', 'ui', 'aws', 'aws-s3', 'python', 'demo', 's3-bucket', 'aws-cli', 'sqlite', 'sqlite-database']",59,2,21,0,3,Shell,53,2,0,5,0,29,0,0,0
criteo/mlflow-yarn,https://github.com/criteo/mlflow-yarn,False,2020-07-15 15:01:14,Backend implementation for running MLFlow projects on Hadoop/YARN.,[],8,10,4,0,1,Python,56,1,0,2,1,21,0,0,0
nkennek/softtriple_pytorch,https://github.com/nkennek/softtriple_pytorch,False,2019-09-19 09:05:06,Unofficial implementation of `SoftTriple Loss: Deep Metric Learning Without Triplet Sampling`,[],6,2,0,0,1,Python,143,6,6,7,0,5,0,0,0
netik1020/Concise-iPython-Notebooks-for-Deep-learning,https://github.com/netik1020/Concise-iPython-Notebooks-for-Deep-learning,False,2019-01-09 11:23:21,"Ipython Notebooks for solving problems like classification, segmentation, generation using latest Deep learning algorithms on different publicly available text and image data-sets. ","['deeplearning', 'deep-neural-networks', 'image-processing', 'image-classification', 'image-segmentation', 'text-classification', 'text-processing', 'text-generation', 'unet-keras', 'keras-neural-networks', 'u-net', 'autoencoder', 'inception-architecture', 'intent-classification', 'semantic-relationship-extraction', 'attention-lstm', 'bi-lstm-crf', 'word-embeddings', 'snapshot']",33,5,12,0,1,Jupyter Notebook,9629,0,0,1,0,99,0,0,0
shengliu66/ELR,https://github.com/shengliu66/ELR,False,2020-06-24 00:00:12,Official Implementation of Early-Learning Regularization Prevents Memorization of Noisy Labels,"['noisy-labels', 'robust-learning', 'deep-learning', 'statistical-learning']",221,9,29,0,2,Python,5167,3,3,4,0,129,0,0,0
adipolak/ms-build-e2e-ml-bigdata,https://github.com/adipolak/ms-build-e2e-ml-bigdata,False,2020-05-12 09:24:28,This repository contains tutorials and resources for you to reproduce Microsoft Build 2020 session -  Building an End-to-End ML Pipeline for Big Data​,[],17,7,6,0,2,Python,19360,5,5,1,0,30,0,0,0
eric-vader/HD-BO-Additive-Models,https://github.com/eric-vader/HD-BO-Additive-Models,False,2020-12-17 02:45:45,Accompanying code for AAAI 2021 publication - High-Dimensional Bayesian Optimization via Tree-Structured Additive Models,[],8,2,1,0,1,Python,10909,0,0,1,0,14,0,0,0
MisterMap/undeepvo,https://github.com/MisterMap/undeepvo,False,2020-05-25 13:58:41,Realization of UnDeepVO method,[],9,4,11,0,5,Jupyter Notebook,5719,8,2,2,0,300,0,0,0
TeoMeWhy/churn-sub,https://github.com/TeoMeWhy/churn-sub,False,2022-07-05 12:42:01,Repo para modelagem preditiva de churn de assinaturas da Gamers Club,[],25,2,24,0,1,Python,36,2,1,1,0,18,0,0,0
pycaret/mlopsworld2021,https://github.com/pycaret/mlopsworld2021,False,2021-06-14 14:43:04,mlopsworld2021,[],12,0,5,0,0,Jupyter Notebook,18686,0,0,1,0,4,0,0,0
manifoldai/orbyter-demo-old,https://github.com/manifoldai/orbyter-demo-old,False,2019-09-12 03:09:59,,[],8,4,1,1,2,Jupyter Notebook,292,1,1,13,1,53,0,0,0
upura/signate-hiroshima-quest-idea,https://github.com/upura/signate-hiroshima-quest-idea,False,2020-07-12 13:48:01,https://upura.hatenablog.com/entry/2020/10/02/202332,[],5,1,1,0,1,Python,472,0,0,1,0,18,0,0,0
studio-ousia/ease,https://github.com/studio-ousia/ease,False,2022-04-10 01:50:25,,[],29,5,1,0,2,Python,15519,0,0,4,0,132,0,0,0
opendp/smartnoise-sdk,https://github.com/opendp/smartnoise-sdk,False,2019-09-23 18:06:00,Tools and service for differentially private processing of tabular and relational data,"['privacy', 'differential-privacy', 'opendp', 'smartnoise']",169,24,41,9,20,Python,40753,22,3,25,14,656,2,0,13
data-science-on-aws/data-science-on-aws,https://github.com/data-science-on-aws/data-science-on-aws,False,2020-02-29 19:33:58,"AI and Machine Learning with Kubeflow, Amazon EKS, and SageMaker",[],2772,107,899,0,12,Jupyter Notebook,1003315,79,2,3,0,3321,0,0,0
LINC-BIT/legodnn,https://github.com/LINC-BIT/legodnn,False,2021-12-08 12:08:46,LegoDNN: a block-grained scaling tool for mobile vision systems,"['mobile', 'vision']",37,11,21,0,2,Python,349018,1,1,1,0,75,0,0,0
Ben8t/football-analytics,https://github.com/Ben8t/football-analytics,False,2020-04-17 12:21:12,,[],8,2,1,0,1,HTML,599827,0,0,11,0,300,0,0,0
toandaominh1997/grow,https://github.com/toandaominh1997/grow,False,2021-06-05 02:42:48,Boost myself,"['microservice', 'python', 'reactjs', 'nginx', 'kafka', 'elasticsearch', 'redis', 'postgres', 'grafana', 'logstash', 'apache-spark', 'golang', 'django', 'fastapi', 'nextjs', 'flutter', 'kubernetes']",6,1,1,0,2,Python,135952,15,15,21,0,365,353,0,642
solliancenet/azure-synapse-analytics-day,https://github.com/solliancenet/azure-synapse-analytics-day,False,2020-03-11 16:09:19,,[],165,29,188,0,10,Jupyter Notebook,64103,12,0,2,0,422,0,0,0
noahgift/databricks-zero-to-mlops,https://github.com/noahgift/databricks-zero-to-mlops,False,2022-02-14 17:28:50,,[],13,2,10,0,1,Python,161,0,0,1,0,158,0,0,0
mbloem/kedro-mlflow-demo,https://github.com/mbloem/kedro-mlflow-demo,False,2020-05-26 09:22:20,Demo of how Kedro+MLflow can work together,[],8,2,2,0,1,Python,68,1,1,2,5,18,0,0,0
vfdev-5/UDA-pytorch,https://github.com/vfdev-5/UDA-pytorch,False,2019-07-16 11:32:43,Unsupervised Data Augmentation experiments in PyTorch,[],55,6,13,0,1,Jupyter Notebook,489,1,0,1,0,11,0,0,0
nyanp/nyaggle,https://github.com/nyanp/nyaggle,False,2019-12-19 02:01:19,Code for Kaggle and Offline Competitions,"['machine-learning', 'kaggle', 'feature-engineering', 'experiment-tracking', 'ml']",254,12,29,16,7,Python,690,8,0,5,16,412,0,0,0
JeremieMelo/NeurOLight,https://github.com/JeremieMelo/NeurOLight,False,2022-09-19 06:17:24,"A Neural Operator-based Integrated Photonic Device Simulation Framework, NeurOLight NeurIPS 2022","['photonics', 'machine-learning', 'neural-networks', 'optics', 'simulation']",12,2,1,0,1,Python,16608,0,0,1,0,2,0,0,0
alina2204/contrastive_SSL_ship_detection,https://github.com/alina2204/contrastive_SSL_ship_detection,False,2021-09-20 13:37:00,Contrastive self supervised learning for ship detection in Sentinel 2 images,[],11,2,0,0,1,Jupyter Notebook,23204,0,0,1,0,13,0,0,0
omnious/ml-starter-project,https://github.com/omnious/ml-starter-project,False,2022-02-25 05:13:40,OMNIOUS repository to get you started with machine learning ,[],5,3,0,0,1,Python,527,0,0,1,0,1,0,0,0
joelcthomas/ml-azuredatabricks,https://github.com/joelcthomas/ml-azuredatabricks,False,2020-04-02 19:19:23,Collection of Machine Learning Examples for Azure Databricks,"['azure', 'databricks', 'machine-learning', 'deep-learning', 'mlflow']",35,4,22,0,1,Python,2302,1,0,1,0,19,0,0,15
IsakZhang/XABSA,https://github.com/IsakZhang/XABSA,False,2021-11-22 11:51:06,,[],6,3,0,0,1,Python,2386,2,0,1,0,3,0,0,0
corradomonti/learnable-opinion-dynamics,https://github.com/corradomonti/learnable-opinion-dynamics,False,2020-05-18 17:06:46,"Code and data for the KDD2020 paper ""Learning Opinion Dynamics From Social Traces""","['kdd2020', 'tensorflow', 'generative-model', 'opinion-dynamics', 'opinion-mining', 'temporal-graphs', 'expectation-maximization', 'statistical-inference']",19,3,7,0,1,Python,3653,0,0,1,0,20,0,0,5
padre-lab-eu/pypads,https://github.com/padre-lab-eu/pypads,False,2020-01-21 12:18:36,"Building on the MLFlow toolset this project aims to extend the functionality for MLFlow, increase the automation and therefore reduce the workload for the user. The production of structured results is an additional goal of the extension.",[],13,4,4,0,3,Python,6863,5,0,14,38,715,0,0,0
U-Alberta/ADaPT-ML,https://github.com/U-Alberta/ADaPT-ML,False,2021-06-24 17:34:33,,[],7,0,2,1,1,Python,27679,3,0,1,2,401,2,0,0
bingblackbean/streamlit_pycaret,https://github.com/bingblackbean/streamlit_pycaret,False,2020-09-04 13:38:00,,[],9,3,8,0,1,Python,1890,0,0,1,0,2,0,0,0
explosion/spacy-loggers,https://github.com/explosion/spacy-loggers,False,2021-09-13 23:08:57,📟 Logging utilities for spaCy,"['nlp', 'spacy', 'natural-language-processing', 'machine-learning', 'logging', 'python']",8,7,12,2,6,Python,37,1,1,1,4,43,0,0,0
hfwittmann/colab-mlflow-papermill,https://github.com/hfwittmann/colab-mlflow-papermill,False,2019-09-14 11:11:40,"Colab,  MLflow and papermill are individually great. Together they form a dream team.",[],11,0,3,0,1,Jupyter Notebook,9,0,0,1,0,5,0,0,0
submission2019/cnn-quantization,https://github.com/submission2019/cnn-quantization,False,2019-01-20 08:00:29,Quantization of Convolutional Neural networks.,"['quantization', 'gemmlowp-quantization', 'convolutional-neural-networks']",186,8,50,0,2,Python,2846,13,0,1,0,72,0,0,0
Ipsedo/MARLClassification,https://github.com/Ipsedo/MARLClassification,False,2019-06-14 08:14:09,Image classification using reinforcement learning and multi-agent system,"['pytorch', 'image-classification', 'reinforcement-learning', 'multi-agent-system', 'article']",18,2,3,0,1,Python,108402,0,0,2,0,279,0,0,0
valeriano-manassero/udacity-projects,https://github.com/valeriano-manassero/udacity-projects,False,2018-11-21 11:30:52,Collection of Projects I implemented during Udacity Nanodegrees and Challenges I applied to,"['machine-learning', 'deep-learning', 'artificial-intelligence', 'tensorflow', 'keras', 'pytorch', 'udacity']",12,1,15,0,2,Jupyter Notebook,14934,0,0,1,0,34,0,0,0
talipucar/SimCLR,https://github.com/talipucar/SimCLR,False,2021-01-08 11:19:58,"Pytorch implementation of the paper, ""A Simple Framework for Contrastive Learning of Visual Representations"", or SimCLR, https://arxiv.org/pdf/2002.05709.pdf ","['simclr', 'self-supervised-learning', 'self-supervised', 'pytorch']",6,1,0,0,2,Python,2344,0,0,1,0,15,0,0,0
mysterious-ben/ds-examples,https://github.com/mysterious-ben/ds-examples,False,2020-04-19 22:19:31,Notebooks and code snipptets testing various Data Science concepts,[],6,1,1,0,1,Jupyter Notebook,38395,19,19,20,0,84,0,0,0
amineds/databricks,https://github.com/amineds/databricks,False,2021-07-06 07:58:13,This repo holds public collaterals related to my job @ Databricks,[],5,1,5,0,1,Python,6202,0,0,1,0,18,0,0,0
BookletAI/lead-scoring-demo,https://github.com/BookletAI/lead-scoring-demo,False,2020-03-06 00:21:34,"Building a end-to-end lead scoring machine learning example with Jupyter, Sagemaker, MLflow, and Booklet.ai.","['lead-scoring', 'mlflow', 'sagemaker', 'sklearn']",17,2,7,0,1,Jupyter Notebook,413,10,10,12,0,11,0,0,0
odahu/odahu-docs,https://github.com/odahu/odahu-docs,False,2019-11-06 08:02:18,Source of Odahu documentation,[],7,4,1,0,9,Python,13103,14,1,32,49,100,0,0,0
jeanCarloMachado/PythonSearch,https://github.com/jeanCarloMachado/PythonSearch,False,2021-07-24 19:40:40,"Collect, retrieve and refactor information efficiently in Python","['search', 'search-engine', 'python', 'ranking', 'machine-learning']",7,3,2,0,3,Python,4035,0,0,6,0,663,0,0,87
Cai-Yichao/yolov4-torch-cp,https://github.com/Cai-Yichao/yolov4-torch-cp,False,2021-01-13 06:59:53,yolov4-pytorch,['pytorch-yolov4'],5,1,1,1,1,Python,7831,0,0,1,1,16,0,0,0
ricardo-jr37/mlflow_tutorial,https://github.com/ricardo-jr37/mlflow_tutorial,False,2021-06-07 15:23:50,,[],8,1,1,0,1,Jupyter Notebook,379,0,0,1,0,4,0,0,0
Ankur3107/nlp_notebooks,https://github.com/Ankur3107/nlp_notebooks,False,2020-08-23 08:10:44,"Tensorflow, Pytorch, Huggingface Transformer, Fastai, etc. tutorial Colab Notebooks.","['tensorflow', 'python', 'pytorch', 'transformer', 'transformers', 'fastai', 'nlp', 'colab-notebook', 'colab', 'lstm', 'classification', 'question-answering', 'machine-translation', 'bert', 'huggingface', 'huggingface-transformers']",44,4,11,0,1,Jupyter Notebook,9067,0,0,2,0,33,0,0,1
j-v-n/Springboard,https://github.com/j-v-n/Springboard,False,2019-11-01 11:24:20,,[],5,1,3,0,1,Jupyter Notebook,21680,0,0,1,0,55,0,0,0
dmatrix/tmls-workshop,https://github.com/dmatrix/tmls-workshop,False,2020-11-16 00:44:32,Toronto Machine Learning MLflow Workshop,"['mlflow', 'machine-learning', 'mlops']",25,3,6,0,1,Jupyter Notebook,70615,0,0,1,0,88,0,0,0
